{
  "profile_id": "mas_alla_del_guion",
  "channel_id": "MAS_ALLA_DEL_GUION",
  "version": "1.2.2",
  "status": "PENDING_FUNCTIONAL_APPROVAL",
  "functional_owner_role": "CHANNEL_INTELLIGENCE",
  "source_lineage": [
    {
      "source_id": "B3-FUNCTIONAL-SPEC-CANONICAL",
      "locator": "docs/specifications/B3_editorial_profile_functional_specification.md",
      "checksum": "899478a6b5be428bca3b8038c3878225f26ae6107aef4f911e69cfe45440265d",
      "role": "FUNCTIONAL_SPECIFICATION"
    }
  ],
  "identity_stable": {
    "identity": "Más Allá del Guion crea videoensayos narrativos y contenidos de reflexión que utilizan películas, series y libros para comprender el comportamiento humano, la sociedad y nuestro tiempo.",
    "purpose": [
      "comportamientos humanos",
      "relaciones",
      "identidad",
      "familia",
      "generaciones",
      "sociedad",
      "poder",
      "instituciones",
      "historia",
      "cultura",
      "tecnología",
      "actualidad",
      "miedo colectivo",
      "educación emocional"
    ],
    "positioning": "Canal de videoensayos narrativos y contenidos de reflexión, humanos y accesibles, que parte de películas, series y libros para desarrollar interpretaciones propias sobre las personas, la sociedad y el presente.",
    "primary_promise": "Ayudar al público a comprender qué revelan las historias sobre cómo vivimos, nos relacionamos y construimos sociedad.",
    "differentiator": [
      "Historia u obra narrativa",
      "conflicto concreto",
      "pregunta humana, social o cultural",
      "investigación",
      "interpretación propia",
      "contraste y matiz",
      "conexión con la realidad",
      "nueva lectura para la audiencia"
    ],
    "editorial_pillars": [
      "Individuo e identidad",
      "Relaciones, familia y generaciones",
      "Sociedad, poder e instituciones",
      "Historia, cultura y nuestro tiempo",
      "Educación emocional"
    ],
    "territories": [
      {
        "name": "Individuo e identidad",
        "classification": "ACTIVE"
      },
      {
        "name": "Relaciones, familia y generaciones",
        "classification": "ACTIVE"
      },
      {
        "name": "Sociedad, poder e instituciones",
        "classification": "ACTIVE"
      },
      {
        "name": "Historia, cultura y nuestro tiempo",
        "classification": "ACTIVE"
      },
      {
        "name": "Educación emocional",
        "classification": "ACTIVE"
      },
      {
        "name": "Actualidad interpretada mediante ficción",
        "classification": "EXPERIMENTAL"
      },
      {
        "name": "Episodios con mayor componente histórico o institucional",
        "classification": "EXPERIMENTAL"
      },
      {
        "name": "Historias reales narrativizadas con evidencia y justificación",
        "classification": "EXPERIMENTAL"
      },
      {
        "name": "Aproximaciones editoriales nuevas que mantienen la promesa central",
        "classification": "EXPERIMENTAL"
      },
      {
        "name": "Noticias generales sin puerta narrativa",
        "classification": "EXCLUDED"
      },
      {
        "name": "Política partidista o propaganda",
        "classification": "EXCLUDED"
      },
      {
        "name": "Crítica cinematográfica convencional",
        "classification": "EXCLUDED"
      },
      {
        "name": "Resúmenes como producto principal",
        "classification": "EXCLUDED"
      },
      {
        "name": "Psicología clínica, terapia y coaching",
        "classification": "EXCLUDED"
      },
      {
        "name": "Tendencias sin profundidad editorial",
        "classification": "EXCLUDED"
      },
      {
        "name": "Conspiraciones presentadas como hechos",
        "classification": "EXCLUDED"
      },
      {
        "name": "Explotación morbosa de tragedias",
        "classification": "EXCLUDED"
      },
      {
        "name": "Territorios secundarios aún no aprobados por Inteligencia del Canal",
        "classification": "PENDING"
      }
    ],
    "permanent_limits": [
      "No inventar",
      "No diagnosticar",
      "No sustituir terapia",
      "No hacer coaching",
      "No manipular mediante dolor",
      "No copiar referentes",
      "No presentar hipótesis como hechos",
      "No deformar fuentes",
      "No convertir el canal en noticias generales",
      "No hacer propaganda partidista",
      "No perseguir cualquier tendencia",
      "No resumir obras como producto principal",
      "No utilizar una estructura idéntica en todos los episodios",
      "No sacrificar la tesis por el packaging",
      "No fingir humanidad mediante anécdotas falsas",
      "No confundir claridad con superficialidad",
      "No utilizar investigación sin interpretación propia",
      "No utilizar emoción sin argumento"
    ],
    "authorial_persona": {
      "acts_as": "Un observador con criterio que piensa junto a la audiencia y utiliza historias para conectar experiencias individuales, estructuras sociales y cambios culturales.",
      "does_not_act_as": [
        "terapeuta",
        "gurú",
        "profesor omnisciente",
        "comentarista partidista",
        "crítico tradicional",
        "narrador totalmente neutro"
      ],
      "voice_traits": [
        "pensamiento en movimiento",
        "observación concreta",
        "asociación natural",
        "paso de lo cotidiano a una reflexión amplia",
        "conexión entre individuo y sociedad",
        "memoria y contraste temporal cuando sean relevantes",
        "criterio autoral",
        "claridad",
        "crítica conversacional",
        "ironía suave",
        "autoconciencia",
        "duda honesta",
        "profundidad accesible"
      ]
    },
    "first_person_rule": "FIRST_PERSON_ALLOWED_WHEN_TRUE_AND_EDITORIALLY_RELEVANT",
    "editorial_purpose": "Utilizar historias y obras narrativas para ayudar a comprender comportamientos humanos, relaciones, estructuras sociales, transformaciones culturales y contradicciones de nuestro tiempo.",
    "first_person_policy": {
      "allowed_uses": [
        "expresar una reacción real",
        "presentar una interpretación propia",
        "reconocer una duda",
        "introducir un recuerdo verdadero",
        "reconocer una contradicción",
        "delimitar una opinión",
        "explicar un cambio de perspectiva"
      ],
      "prohibited_inventions": [
        "experiencias",
        "recuerdos",
        "emociones",
        "opiniones",
        "relación personal con una obra",
        "vulnerabilidad",
        "autoridad autobiográfica"
      ]
    }
  },
  "audience_hypotheses": [
    {
      "classification": "AUDIENCE_HYPOTHESIS_INITIAL",
      "statement": "Audiencia aproximada de 25 a 45 años; revisable mediante aprendizaje del canal, evidencia de audiencia, evolución editorial, formatos y consumo real.",
      "status": "HYPOTHESIS"
    },
    {
      "classification": "AUDIENCE_HYPOTHESIS_QUALITATIVE",
      "statement": "Adultos hispanohablantes interesados en películas, series, libros, comportamiento humano, cultura y sociedad; buscan profundidad con lenguaje accesible, no requieren formación previa y rechazan coaching, academicismo innecesario, resúmenes extensos, moralización y sensacionalismo.",
      "status": "HYPOTHESIS"
    }
  ],
  "voice_profile": {
    "corpus_status": "AUTHENTIC_CORPUS_PARTIAL",
    "approved_sample_ids": [
      "MADG-AUTH-001"
    ],
    "initial_authorized_patterns": [
      "pensamiento asociativo",
      "memoria concreta",
      "reflexión generacional",
      "objetos cotidianos",
      "contraste entre pasado y presente",
      "paso de experiencia individual a lectura colectiva",
      "crítica sin academicismo",
      "ironía suave",
      "cierre paradójico",
      "autoconciencia",
      "claridad directa",
      "orientación práctica",
      "rechazo de duplicación",
      "detección de desviaciones",
      "preferencia por lenguaje sencillo",
      "separación de responsabilidades",
      "prioridad del resultado útil"
    ],
    "anti_imitation_rules": [
      "La voz editorial se rige por la especificación canónica y por la evidencia auténtica autorizada disponible",
      "Los referentes externos son recursos parciales, nunca un modelo total de imitación",
      "Los errores de digitación y escritura rápida no son rasgos de voz"
    ],
    "approved_positive_examples": [
      "La película presenta esta decisión como un acto de valentía. Pero, cuando observamos sus consecuencias, también puede interpretarse como una forma de egoísmo. Y quizá por eso la escena resulta tan incómoda: porque no habla solamente del personaje. Habla de lo fácil que es justificar una decisión cuando creemos estar del lado correcto."
    ],
    "approved_negative_examples": [
      "No estás roto. Lo que ocurre es que llevas toda la vida intentando sanar una herida que nunca fue tu culpa.",
      "Y aquí es donde la película se pone brutal, porque básicamente el protagonista decide mandar todo al demonio.",
      "Desde una perspectiva foucaultiana, el dispositivo panóptico articula una relación epistémica entre sujeto y estructura disciplinaria."
    ],
    "reference_boundaries": [
      {
        "reference_name": "Farid Dieck",
        "may_inspire": [
          "conexión emocional",
          "preguntas humanas",
          "transformación narrativa",
          "accesibilidad",
          "sensibilidad hacia los personajes"
        ],
        "must_not_copy": [
          "voz",
          "expresiones",
          "sentimentalismo",
          "moralización",
          "estructura reconocible",
          "identidad de guía emocional",
          "fórmula fija de relato"
        ]
      },
      {
        "reference_name": "Mohamed Dávila",
        "may_inspire": [
          "claridad pedagógica",
          "analogías",
          "presencia autoral",
          "naturalidad",
          "conexión entre ficción y actualidad",
          "explicación de ideas complejas",